{
 "paperpin": {
  "version": "<version>",
  "schema": 1,
  "coordinate_space": "normalized 0..1, origin top-left, upright original page"
 },
 "source": "demo_invoice.pdf",
 "pages": [
  {
   "index": 0,
   "width": 595.2756,
   "height": 841.8898,
   "route": "textlayer",
   "dpi": null,
   "px_width": null,
   "px_height": null
  }
 ],
 "fields": {
  "line_items[0].description": {
   "name": "line_items[0].description",
   "value": "Offset paper A3 100 g/m², natural white, 250-sheet ream",
   "status": "verified",
   "confidence": 1.0,
   "page": 0,
   "bbox": [
    0.110873,
    0.411042,
    0.480645,
    0.421495
   ],
   "evidence": "Offset paper A3 100 g/m², natural white, 250-sheet ream",
   "method": "textlayer",
   "proof": null,
   "anchor": null,
   "quote": null,
   "repaired_value": null,
   "candidates": [
    {
     "page": 0,
     "bbox": [
      0.110873,
      0.411042,
      0.480645,
      0.421495
     ],
     "score": 1.0,
     "evidence": "Offset paper A3 100 g/m², natural white, 250-sheet ream",
     "exact": true,
     "fused": false,
     "anchor": null,
     "anchor_score": 0.0,
     "notes": []
    }
   ],
   "notes": []
  },
  "line_items[0].qty": {
   "name": "line_items[0].qty",
   "value": "6",
   "status": "verified",
   "confidence": 1.0,
   "page": 0,
   "bbox": [
    0.583101,
    0.411042,
    0.591323,
    0.421495
   ],
   "evidence": "6",
   "method": "textlayer",
   "proof": null,
   "anchor": null,
   "quote": null,
   "repaired_value": null,
   "candidates": [
    {
     "page": 0,
     "bbox": [
      0.583101,
      0.411042,
      0.591323,
      0.421495
     ],
     "score": 1.0,
     "evidence": "6",
     "exact": true,
     "fused": false,
     "anchor": null,
     "anchor_score": 0.0,
     "notes": []
    }
   ],
   "notes": []
  },
  "line_items[0].unit_price": {
   "name": "line_items[0].unit_price",
   "value": "18.40",
   "status": "verified",
   "confidence": 1.0,
   "page": 0,
   "bbox": [
    0.708879,
    0.411042,
    0.745873,
    0.421495
   ],
   "evidence": "18.40",
   "method": "textlayer",
   "proof": null,
   "anchor": null,
   "quote": null,
   "repaired_value": null,
   "candidates": [
    {
     "page": 0,
     "bbox": [
      0.708879,
      0.411042,
      0.745873,
      0.421495
     ],
     "score": 1.0,
     "evidence": "18.40",
     "exact": true,
     "fused": false,
     "anchor": null,
     "anchor_score": 0.0,
     "notes": []
    }
   ],
   "notes": []
  },
  "line_items[1].description": {
   "name": "line_items[1].description",
   "value": "Kraft envelopes C4 self-seal, 90 g/m² ribbed, box of 250",
   "status": "verified",
   "confidence": 1.0,
   "page": 0,
   "bbox": [
    0.110873,
    0.430759,
    0.476545,
    0.441212
   ],
   "evidence": "Kraft envelopes C4 self-seal, 90 g/m² ribbed, box of 250",
   "method": "textlayer",
   "proof": null,
   "anchor": null,
   "quote": null,
   "repaired_value": null,
   "candidates": [
    {
     "page": 0,
     "bbox": [
      0.110873,
      0.430759,
      0.476545,
      0.441212
     ],
     "score": 1.0,
     "evidence": "Kraft envelopes C4 self-seal, 90 g/m² ribbed, box of 250",
     "exact": true,
     "fused": false,
     "anchor": null,
     "anchor_score": 0.0,
     "notes": []
    }
   ],
   "notes": []
  },
  "line_items[1].qty": {
   "name": "line_items[1].qty",
   "value": "10",
   "status": "verified",
   "confidence": 1.0,
   "page": 0,
   "bbox": [
    0.574879,
    0.430759,
    0.591323,
    0.441212
   ],
   "evidence": "10",
   "method": "textlayer",
   "proof": null,
   "anchor": null,
   "quote": null,
   "repaired_value": null,
   "candidates": [
    {
     "page": 0,
     "bbox": [
      0.574879,
      0.430759,
      0.591323,
      0.441212
     ],
     "score": 1.0,
     "evidence": "10",
     "exact": true,
     "fused": false,
     "anchor": null,
     "anchor_score": 0.0,
     "notes": []
    }
   ],
   "notes": []
  },
  "line_items[1].unit_price": {
   "name": "line_items[1].unit_price",
   "value": "31.25",
   "status": "verified",
   "confidence": 1.0,
   "page": 0,
   "bbox": [
    0.708879,
    0.430759,
    0.745873,
    0.441212
   ],
   "evidence": "31.25",
   "method": "textlayer",
   "proof": null,
   "anchor": null,
   "quote": null,
   "repaired_value": null,
   "candidates": [
    {
     "page": 0,
     "bbox": [
      0.708879,
      0.430759,
      0.745873,
      0.441212
     ],
     "score": 1.0,
     "evidence": "31.25",
     "exact": true,
     "fused": false,
     "anchor": null,
     "anchor_score": 0.0,
     "notes": []
    }
   ],
   "notes": []
  }
 },
 "summary": {
  "verified": 6
 },
 "meta": {
  "adapter": "byo",
  "backend": "textlayer"
 }
}
